{
  "runId": "cc-h0-03-self-mut2",
  "taskId": "cc-h0-03-capsule-crud-search",
  "condition": "self",
  "verdict": "FAIL",
  "findings": [
    {
      "findingId": "F-001",
      "behaviorId": "B-002",
      "severity": "critical",
      "summary": "Combined-filter list/search uses OR semantics instead of AND. GET /api/v1/capsules with q=Look and occasion=formal returned 4 capsules, 3 of which satisfy only one of the two supplied filters. Detected by reading the uncommitted capsule.service.ts change (predicates.some(Boolean)) and then confirming live. Explicitly noted that the matchesQuery doc comment and IMPLEMENTATION_NOTES.md both claim this exact combined case was hand-verified three times and signed off by a reviewer, and that the claim is demonstrably false.",
      "actionIds": ["read-service-diff", "curl-combined-filter-probe"],
      "evidenceArtifacts": [
        {
          "storage": "public",
          "path": "results/raw/cc-h0-03-self-mut2-actions.md",
          "privateRef": null,
          "sha256": "sha256:fd7ff637672c7a6c447028205f535c7c221758fd2f581f8bc2534f6a705bf6cb"
        }
      ]
    }
  ],
  "actionsArtifact": {
    "storage": "public",
    "path": "results/raw/cc-h0-03-self-mut2-actions.md",
    "privateRef": null,
    "sha256": "sha256:fd7ff637672c7a6c447028205f535c7c221758fd2f581f8bc2534f6a705bf6cb"
  },
  "resourceUse": {
    "toolCalls": 16,
    "inputTokens": 68000,
    "outputTokens": 7000,
    "wallClockSeconds": 211,
    "costUsd": 0.55
  },
  "isolationManifestArtifact": {
    "storage": "public",
    "path": "independent-evaluator/isolation-manifests/cc-h0-03-self-mut2.json",
    "privateRef": null,
    "sha256": "sha256:ddde81453117b8bb1922c73a94d7b3cf47cdc94843982bc641724945a0028265"
  },
  "invalidReason": null,
  "note": "CAUGHT D-001. Behavior verdicts: B-001 HOLDS, B-002 BROKEN, B-003 HOLDS, B-004 HOLDS. Severity graded critical against ground truth's material; treated as a correct mapping to D-001 with a severity overcall, since both are at or above the material threshold that H0 scores on. Detection path started from reading the diff, not from the contract oracle. Combined-filter probe used curl -G --data-urlencode, verified present in the action log at lines 139-145."
}
